{
  "id": "0199f2b2-0004-7a00-8b00-000000000004",
  "type": "order.confirmed",
  "source": "order",
  "specversion": "1.0",
  "time": "2026-10-26T03:12:40.906Z",
  "subject": "0199f2b1-7a10-7b2c-9d3e-4f5a6b7c8d01",
  "dataschema": "order.confirmed/v1",
  "traceparent": "00-4bf92f3577b34da6a3ce929d0e0e4736-00f067aa0ba902b7-01",
  "data": {
    "orderId": "0199f2b1-7a10-7b2c-9d3e-4f5a6b7c8d01",
    "buyerId": "0199f2e0-0000-7000-8000-000000000001",
    "total": {
      "amount": 158000,
      "currency": "IDR"
    },
    "lines": [
      {
        "sku": "KAOS-001-M",
        "quantity": 2,
        "unitPrice": {
          "amount": 79000,
          "currency": "IDR"
        }
      }
    ],
    "confirmedAt": "2026-10-26T03:12:40.906Z"
  }
}
