{
  "id": "0199f2b2-0003-7a00-8b00-000000000003",
  "type": "payment.refunded",
  "source": "payment",
  "specversion": "1.0",
  "time": "2026-10-26T03:20:11.940Z",
  "subject": "0199f2b1-7a10-7b2c-9d3e-4f5a6b7c8d03",
  "dataschema": "payment.refunded/v1",
  "traceparent": "00-4bf92f3577b34da6a3ce929d0e0e4736-00f067aa0ba902b7-01",
  "data": {
    "orderId": "0199f2b1-7a10-7b2c-9d3e-4f5a6b7c8d03",
    "paymentIntentId": "0199f2b1-7b22-7c31-a4d5-6e7f8091a2b6",
    "refundId": "0199f2b1-8c01-7d41-8b6a-2f1e9c7d4a11",
    "amount": {
      "amount": 79000,
      "currency": "IDR"
    },
    "refundedAt": "2026-10-26T03:20:11.940Z"
  }
}
